{
  "$schema": "https://json-schema.org/draft/2020-12/schema",
  "$id": "jira-knowledge-schema-v0.1",
  "title": "Jira 업무지식 Schema v0.1",
  "type": "object",
  "additionalProperties": false,
  "required": [
    "knowledge_schema_version",
    "issue_key",
    "issue_summary",
    "problem_or_goal",
    "key_findings",
    "actions_and_decisions",
    "outcomes",
    "open_items"
  ],
  "properties": {
    "knowledge_schema_version": {"const": "0.1"},
    "issue_key": {"type": "string", "minLength": 1},
    "issue_summary": {"$ref": "#/$defs/item"},
    "problem_or_goal": {"type": "array", "items": {"$ref": "#/$defs/item"}},
    "key_findings": {"type": "array", "items": {"$ref": "#/$defs/item"}},
    "actions_and_decisions": {"type": "array", "items": {"$ref": "#/$defs/item"}},
    "outcomes": {"type": "array", "items": {"$ref": "#/$defs/item"}},
    "open_items": {"type": "array", "items": {"$ref": "#/$defs/item"}}
  },
  "$defs": {
    "item": {
      "type": "object",
      "additionalProperties": false,
      "required": ["statement", "evidence_refs"],
      "properties": {
        "statement": {"type": "string", "minLength": 1},
        "evidence_refs": {
          "type": "array",
          "minItems": 1,
          "uniqueItems": true,
          "items": {
            "type": "string",
            "pattern": "^(summary|description|comment:[^:]+|attachment:[^:]+|relationship:[^:]+|custom_field:[^:]+)$"
          }
        }
      }
    }
  }
}
